{
  "$schema": "http://json-schema.org/draft-07/schema#",
  "$id": "https://raw.githubusercontent.com/xai-org/grok-build/main/schemas/plugin-manifest.schema.json",
  "title": "Grok Build / Claude plugin manifest",
  "description": "Schema for plugin.json, .grok-plugin/plugin.json, and .claude-plugin/plugin.json, checked in that priority order within a plugin root (first found wins); if none is found the plugin still functions via convention-based discovery. Forward-compatible: unknown top-level fields are silently ignored (no deny_unknown_fields), so this schema never restricts additional properties.",
  "type": "object",
  "properties": {
    "name": {
      "type": "string",
      "minLength": 1,
      "maxLength": 64,
      "pattern": "^[a-z0-9]([a-z0-9-]*[a-z0-9])?$",
      "description": "User-facing plugin namespace, kebab-case. Required at the struct level (no serde default). The 1-64-char, lowercase-ascii-alnum-plus-hyphen, no-leading/trailing-hyphen shape is enforced by PluginManifest::validate(), which load_manifest() calls right after parsing -- it is not a raw-deserialization constraint (any non-empty JSON string deserializes fine as \"name\")."
    },
    "version": {
      "type": ["string", "null"],
      "description": "Semver-style version string; not format-validated by this crate."
    },
    "description": {
      "type": ["string", "null"],
      "description": "Human-readable plugin description."
    },
    "author": {
      "description": "Author metadata.",
      "anyOf": [
        { "$ref": "#/$defs/author" },
        { "type": "null" }
      ]
    },
    "homepage": {
      "type": ["string", "null"],
      "description": "."
    },
    "repository": {
      "type": ["string", "null"],
      "description": "."
    },
    "license": {
      "type": ["string", "null"],
      "description": "SPDX-style license identifier; not format-validated."
    },
    "keywords": {
      "type": "array",
      "items": { "type": "string" },
      "default": [],
      "description": "Search/discovery keywords; defaults to an empty array."
    },
    "skills": {
      "description": "Overrides the default skills/ convention directory; a single path or an array of paths, each resolved relative to the plugin root and rejected (with a warning, not an error) if it escapes the plugin root via '..'.",
      "anyOf": [
        { "$ref": "#/$defs/pathOrPaths" },
        { "type": "null" }
      ]
    },
    "commands": {
      "description": "Overrides the default commands/ convention directory; same single-or-multiple-path shape as skills.",
      "anyOf": [
        { "$ref": "#/$defs/pathOrPaths" },
        { "type": "null" }
      ]
    },
    "agents": {
      "description": "Overrides the default agents/ convention directory; same single-or-multiple-path shape as skills.",
      "anyOf": [
        { "$ref": "#/$defs/pathOrPaths" },
        { "type": "null" }
      ]
    },
    "hooks": {
      "description": "Path to a hooks JSON file, or an inline hooks document (e.g. {\"hooks\": {...}}), fully supported by the runtime; defaults to hooks/hooks.json at the plugin root when this field is absent.",
      "anyOf": [
        { "$ref": "#/$defs/pathOrInline" },
        { "type": "null" }
      ]
    },
    "mcpServers": {
      "description": "Path to a .mcp.json file, or an inline MCP servers document; the Rust field mcp_servers is renamed to mcpServers by this struct's camelCase rename_all. Defaults to .mcp.json at the plugin root when absent; an inline value does not suppress a sibling .mcp.json file.",
      "anyOf": [
        { "$ref": "#/$defs/pathOrInline" },
        { "type": "null" }
      ]
    },
    "lspServers": {
      "description": "Path to an LSP servers document, or an inline document; the Rust field lsp_servers is renamed to lspServers. Defaults to .lsp.json at the plugin root when absent.",
      "anyOf": [
        { "$ref": "#/$defs/pathOrInline" },
        { "type": "null" }
      ]
    }
  },
  "required": ["name"],
  "x-source-rev": "9b8d35b46d959c042ea9aa31cbbebbd1f0c5c527",
  "$defs": {
    "author": {
      "type": "object",
      "description": "Author metadata block.",
      "properties": {
        "name": {
          "type": ["string", "null"],
          "description": "."
        },
        "email": {
          "type": ["string", "null"],
          "description": "."
        },
        "url": {
          "type": ["string", "null"],
          "description": "."
        }
      }
    },
    "pathOrPaths": {
      "description": "Untagged PathOrPaths: a JSON string (single path) or an array of JSON strings (multiple paths). Any other shape, or an array containing a non-string element, fails to deserialize because neither enum variant matches.",
      "anyOf": [
        { "type": "string" },
        { "type": "array", "items": { "type": "string" } }
      ]
    },
    "pathOrInline": {
      "description": "Untagged PathOrInline: a JSON string is treated as a file path relative to the plugin root; any other JSON value (object, array, number, boolean, or null) is treated as an inline value via serde_json::Value, which accepts literally anything, so this schema places no shape constraint on the non-string case, matching that leniency.",
      "anyOf": [
        { "type": "string" },
        {}
      ]
    }
  }
}
