{
  "name": "deployment-tools",
  "version": "1.2.0",
  "description": "Tools for deployment",
  "author": { "name": "Test Author", "email": "test@example.com", "url": "https://example.com/author" },
  "homepage": "https://example.com",
  "repository": "https://github.com/example/plugin",
  "license": "MIT",
  "keywords": ["ci-cd", "deploy"],
  "skills": "./custom/skills/",
  "commands": ["./cmds-a/", "./cmds-b/"],
  "agents": "./custom-agents/",
  "hooks": "./config/hooks.json",
  "mcpServers": "./mcp-config.json",
  "lspServers": { "lsp": {} }
}
